title,link,description
Microbial-driven atmospheric CO2 conversion for large-scale carbon sequestration,https://techfinder.stanford.edu/technology/microbial-driven-atmospheric-co2-conversion-large-scale-carbon-sequestration,"Stanford scientists have developed a method that utilizes specialized microbes to capture and convert dilute atmospheric carbon dioxide into reduced organic compounds. This innovative technology, capable of metabolizing CO2 at low, atmospheric concentrations, offers a promising approach to large-scale carbon sequestration, potentially contributing to global efforts to remove tens of gigatons of carbon dioxide annually by 2030. Carbon dioxide (CO2) is a primary contributor to global warming, with atmospheric concentrations steadily increasing due to human activities. Traditional CO2 capture methods often require energy-intensive processes to concentrate and convert the gas, and there are limited end uses for CO2, reducing incentive for CO2 capture and limiting the large-scale applicability. Biological systems, particularly CO2-respiring microbes, offer a promising alternative due to their ability to metabolize CO2 at low concentrations and ambient conditions. Unlike energy-intensive chemical processes, these commonly anaerobic microorganisms can directly capture and convert dilute CO2 into useful organic compounds, operating efficiently in moderately alkaline solutions at ambient temperatures and pressures. Understanding the mechanisms of microbial CO2 metabolism and the conditions that facilitate it could lead to the development of efficient, large-scale carbon capture and conversion technologies. Preliminary experiments with the microbial CO2 capture and conversion system demonstrated successful production of reduced carbon compounds from indoor air. Importantly, the system consumed CO2 to levels below average atmospheric concentrations at sea level, indicating effective carbon sequestration. These results suggest that the microbial technology is capable of both capturing and converting dilute atmospheric CO2. Consequently, this approach has the potential to significantly contribute to global carbon sequestration efforts and transform climate change mitigation strategies by offering a sustainable method to remove CO2 from the atmosphere while producing valuable organic compounds. Stage of Development: Proof of Concept Continued research – Operation of the technology in a continuous system at a larger scale. Optimize process to maximize energetic conversion and efficiency. Identifying microbial ecologies to mediate and enhance the robustness of the process. Applications include Large-scale atmospheric carbon dioxide removal, Production of valuable reduced organic compounds, Integration with industrial processes for on-site carbon capture and utilization. Advantages of the device are Captures and converts CO2 at low, atmospheric concentrations from gas or aqueous streams, Operates at ambient temperatures and pressures, reducing energy requirements, Tolerant to common industrial gas impurities like hydrogen sulfide and sulfur oxides, Potential for continuous operation without the need for regeneration steps."
Subterranean thermal energy storage system for concentrating solar power,https://techfinder.stanford.edu/technology/subterranean-thermal-energy-storage-system-concentrating-solar-power,"Researchers in the Stanford School of Sustainability have patented a sustainable, cost-effective, scalable subsurface energy storage system with the potential to revolutionize solar thermal energy storage by making solar energy available 24/7 for a wide range of industrial applications. Subsurface thermal energy storage addresses key challenges faced by solar thermal energy: intermittency and the need for large-scale, long-term storage. Instead of using above ground insulated tanks with exotic molten salts for energy storage, this method (see Figure 1) uses the vast pore volume of depleted oil and gas fields for heat storage, which reduces above-ground infrastructure, cuts costs, increases the amount of energy that may be stored, is scalable, and potentially reduces heat losses.  The heat is stored in the reservoir until there is a demand for energy. The energy is brought to the surface and can be used to generate electricity or process heat, making the system adaptable for different industrial applications, and potentially converting solar thermal energy to a base load renewable energy.   Figure 1 Subsurface storage system for thermal energy (Image courtesy SUETRI-A) Solar collectors generate saturated steam, which is injected into underground reservoirs (ideally warmed from past thermally enhanced oil recovery (TEOR) processes, minimizing heat loss).  Heat is withdrawn from the reservoir as saturated steam and is used to operate an active thermal recovery project (such as a producing thermally enhanced oil reservoir) and/or to generate electricity. Applications include Clean energy:, Concentrated solar energy, Steam-powered electricity generation , Thermal oil recovery (TEOR) and decarbonization in oil production, Industrial processes requiring  heat. Advantages of the device are Reduces costs, Less expensive than molten salts used in conventional solar heat storage, Significantly reduces the need for above-ground infrastructure and costs compared to conventional systems, Leverages existing oil field infrastructure, Scalable, large-scale storage with expanded energy capacity, Reduces heat loss, Dual functionality and adaptable for different industrial applications, Reduces carbon dioxide footprint of thermally enhanced oil recovery  - shifts fuel from natural gas to solar radiation, Balances the daily and seasonal variations of solar radiation, Reduces operational risk - integration of existing geothermal and oil extraction techniques reduces operational risk and leverages geothermal technology to handle steam and mitigate issues like scale formation in wellbore equipment."
Plasmonic gas diffusion reactor for CO2 conversion to high-value chemicals,https://techfinder.stanford.edu/technology/plasmonic-gas-diffusion-reactor-co2-conversion-high-value-chemicals,"Industry, government, and private investment in CO2 capture is growing to address climate change.  Without carbon utilization, however, high costs impede large scale capture efforts.  Alexander Al Zubeidi, a Stanford post doc in the D-Lab, has developed an inexpensive, scalable gas flow cell based system to convert atmospheric CO2 to other hydrocarbon based chemicals (like ethylene) using light and excess renewable electricity.   Figure 1 – Prototype Cell Process (Image courtesy the D-Lab) In the prototype system, gas enters the reactor cell via a gas flow channel, flows over the gas diffusion electrode covered in copper nanoparticles and electrolyte solution at ambient temperature.  Visible light (450-800 nm) enters through the cell window, exciting copper nanoparticle electrons that reduce CO2 to ethylene.  These electrolyzers can produce hydrocarbon based chemicals and syngas, a mixture of H2 and O2. Unlike competing electrolyzers that are built to operate on large scales, with long payback periods that typically require high capacity factors, the D-Lab system (Figure 2) can operate when renewable energy is in excess, generating net-zero emissions and converting point-source CO2 emissions to high-value products.  This inexpensive, scalable plasmonic gas flow reactor system provides cost effective carbon capture CO2 gas separation and storage while producing valuable feedstocks for the chemical industry or zero-carbon fuels.   Figure 2 – Scaled Up Reactor Array  (Image courtesy the D-Lab) Stage of Development – Proof of Concept Prototype Applications include Industrial chemical production, especially ethylene, Green fuel / hydrocarbon based fuel production, Syngas production. Advantages of the device are Low cost ethylene production with high cap-ex return:  A 20 x 20 cm2 reactor operating at 80% selectivity for ethylene at 0.5 A/ cm2 operated 6 h a day can produce enough ethylene in 1 month to pay for itself., Compact, scalable and mass producible: Easy to ship and scale up using eletrolyzers in parallel to keep production and supply chain uncomplicated., No purification of reactants: The gas diffusion electrode operates with captured CO2 and gas mixtures containing CO2, which reduces upfront costs and energy consumption., Operates at ambient temperature: The electrolyzer can be started and shut down rapidly, allowing it to only operate when electricity costs are low., Does not require CH3."
Using deep learning to predict ankle-brachial index from Doppler sounds in diabetic patients,https://techfinder.stanford.edu/technology/using-deep-learning-predict-ankle-brachial-index-doppler-sounds-diabetic-patients,"Stanford researchers have developed AutoABI, a deep learning system that predicts ankle-brachial index (ABI) from Doppler ultrasound sounds. This approach offers a new method for ABI measurements, particularly useful for patients with non-compressible arteries, such as those with diabetes. By analyzing Doppler sounds, AutoABI provides a straightforward way to assess peripheral artery disease (PAD) risk without traditional blood pressure cuffs. The system could improve the accessibility and efficiency of PAD diagnosis in point-of-care settings, where quick and accurate assessments are valuable. Ankle-brachial index (ABI) is a crucial diagnostic tool for peripheral artery disease (PAD), but current measurement methods face significant limitations. Traditional ABI assessment requires inflating a blood pressure cuff while using Doppler ultrasound to measure blood flow in the tibial arteries. However, this technique proves unreliable in patients with non-compressible arteries, a common condition in diabetics with PAD. These patients often have medial arterial calcification, leading to falsely elevated and unreliable ABI readings. The prevalence of diabetes and the increasing need for accurate PAD diagnosis underscores the importance of developing more versatile, point-of-care ABI measurement techniques. An improved method that can provide reliable ABI estimates without relying on blood pressure cuffs could significantly enhance PAD diagnosis and management, particularly in challenging patient populations. AutoABI, a deep learning system integrated into a hand-held Doppler device, successfully predicts ankle-brachial index (ABI) directly from audible Doppler sounds without the need for blood pressure cuffs. This innovative approach enables ABI measurements in patients with non-compressible arteries, a common issue in diabetics with PAD. The device's on-board computer processes Doppler signals in real-time, displaying results on an integrated touch screen for immediate clinical use. By offering a more versatile and accessible method for ABI assessment, AutoABI has the potential to significantly improve PAD diagnosis and management across various healthcare settings, from hospital wards to vascular labs. Stage of Development: Prototype Continued research: fully integrating the computer and deep learning computation within the Doppler device itself, eliminating the need for external processing and creating a self-contained, portable ABI measurement system. Applications include Diagnosis and monitoring of peripheral artery disease (PAD), Ankle-brachial index (ABI) measurements in patients with non-compressible arteries, such as diabetics, Point-of-care vascular health assessments in clinics and hospital wards, Integration into existing vascular lab equipment for enhanced capabilities. Advantages of the device are Eliminates the need for blood pressure cuffs in ABI measurements, Provides reliable ABI estimates for patients with calcified arteries, Increases accessibility of ABI testing in various clinical settings, Offers real-time, on-device processing and results display, Simplifies the ABI measurement process for healthcare providers, Potential for improved PAD diagnosis rates and patient outcomes."
Ultrasound Imaging with Spectral Compounding for Speckle Reduction,https://techfinder.stanford.edu/technology/ultrasound-imaging-spectral-compounding-speckle-reduction,"Stanford researchers at the Steven Chu Lab have developed and patented a method and apparatus to optimize speckle suppression in ultrasound imaging, usable for diagnostic purposes.  This method uses Fourier-transform limited pulses for spectral compounding. The optimization of pulse shape allows for the optimization of the trade-off between speckle reduction and axial resolution. Compared to images without spectral compounding, this invention can reduce the speckle noise by 2-3X and dramatically improve image quality, as demonstrated in preliminary data. Figure Stage of Development - Proof of Concept Applications include Diagnostic Ultrasound Imaging. Advantages of the device are Method minimizes speckle for given spatial resolution, Improves image quality, Enables general diagnostic purposes."
Therapeutic targets to limit high-grade glioma spread,https://techfinder.stanford.edu/technology/therapeutic-targets-limit-high-grade-glioma-spread,"Researchers in Dr. Michelle Monje-Deisseroth's lab at Stanford have identified therapeutic targets for drug development to limit the spread of high-grade gliomas (HGGs). HGGs, including glioblastoma and diffuse intrinsic pontine glioma, are a group of brain cancers with dire prognosis. They frequently invade a region of the brain called the subventricular zone (SVZ) and this spread correlates with decreased survival. Currently the only therapeutic approach to limit spreading into the SVZ is not optimal as it involves irradiation of the SVZ, which can cause very serious side effects. Thus, new targeted therapeutic strategies are needed. The inventors have determined that SVZ invasion is promoted by the secretion of pleiotrophin, which forms a complex with a group of proteins that acts as a chemoattractant for the glioma to the SVZ. Therapeutic agents that inhibit this chemoattractant complex, such as inhibitory nucleic acids, thus provide a strategy for treating HGGs. This technology provides potential new targets for drug development to limit the spread of deadly brain cancers. Figure Applications include Drug development- new targets for development of therapeutics to treat gliomas, Inhibitory nucleic acids (shRNA, siRNA, miRNA, ASOs) to treat HGG spread. Advantages of the device are Unmet medical need- existing therapeutic strategy is non-optimal, Provides new targets for therapeutic development."
An automated tool for vascular and perivascular segmentation of brain MRI data to identify the risk of dementia and accelerated brain atrophy,https://techfinder.stanford.edu/technology/automated-tool-vascular-and-perivascular-segmentation-brain-mri-data-identify-risk,"Stanford scientists have developed PVSeg, a tool that automatically segments vascular and perivascular compartments in brain MRI data. This innovative tool can identify non-demented individuals at increased risk of developing dementia and accelerated brain atrophy. PVSeg's metrics could serve as a screening tool, allowing early diagnosis of brain microvascular issues and potentially improving patient treatments and outcomes. Additionally, it could enrich clinical trials for treatments targeting cognitive decline by identifying suitable candidates at increased risk of future cognitive impairment, thereby reducing subject enrollment challenges and decreasing costs. Moreover, in clinical trials specifically targeting Alzheimer's disease pathology (amyloid-β and tau), PVSeg's metrics can refine the selection of participants with a ""purer"" form of preclinical Alzheimer's disease by identifying and screening out individuals with radiographic signs of vascular damage, improving efficiency and effectiveness of clinical trials for Alzheimer's disease. Finally, PVSeg's metrics are suitable for longitudinal assessments, allowing the evaluation of treatment effects on the brain vasculature in-vivo. Cerebral small vessel disease is a significant contributor to cognitive decline and dementia. Currently, clinicians use magnetic resonance imaging (MRI) to detect signs of vascular damage in the brain, such as white matter hyperintensities and microbleeds. However, these markers are often subtle in healthy individuals and lack quantitative precision. Recent advancements allow for the measurement of brain vasculature and perivascular spaces using standard T1-weighted MRI scans. Yet, current techniques have notable limitations: they are user-dependent, leading to potential inconsistencies, and lack inter-scanner reproducibility. These drawbacks hinder the execution of large-scale, longitudinal studies and clinical trials crucial for understanding the relationship between vascular changes and cognitive impairment over time. There is a clear need for a more robust, automated method to quantify cerebral vascular structures consistently across different MRI machines and over extended periods. A novel, fully automated algorithm has been developed to assess perivascular diameter and count of blood vessels with MRI-visible perivascular space in white matter and basal ganglia using standard 3D T1-weighted MRI scans. PVSeg demonstrates excellent inter-scanner and test-retest reproducibility, addressing key limitations of current methods. Importantly, the algorithm revealed significant associations between vascular metrics and dementia risk, as well as brain atrophy rates, in a large-scale study (>10,000 subjects). By enabling more efficient screening in clinical trials, PVSeg has the potential to substantially reduce required participant numbers and to refine their selection, thereby increasing trial power and reducing costs in dementia research. Stage of Development:  Applications include Assessment of cerebral small vessel disease and its relation to cognitive decline, Early detection of individuals at high risk for dementia, Enrichment of clinical trials for cognitive impairment and dementia, Evaluation of treatment effects on brain vasculature in-vivo. Advantages of the device are Fully automated segmentation of vascular and perivascular compartments in brain MRI, Excellent inter-scanner reproducibility and test-retest repeatability, Robust performance in longitudinal studies, Requires only standard T1-weighted MRI sequences, enabling widespread use, Potential for significant cost reduction in clinical trials through improved participant selection."
Electronic Lateral Flow Assay Rapidly Detects and Quantifies Multiple Compounds Wirelessly,https://techfinder.stanford.edu/technology/electronic-lateral-flow-assay-rapidly-detects-and-quantifies-multiple-compounds,"Stanford researchers have developed a electrochemical lateral flow assay (eLFA) diagnostics platform that eliminates the instrumentation typically needed to analyze or read point of use tests. Point of use tests are commonly conducted under scenarios where resources are scarce. They are utilized in order to rapidly detect and quantify multiple compounds of interest in biological, chemical and environmental samples. However, instrumentation cost, size and power requirements can severely limit utilization of point of use tests in resource-limited settings. Elimination of the instrumentation typically required to analyze or read point of use tests would enable modern diagnostics technologies to be employed more widely. This would provide users with real-time, actionable health and/or environmental information. Therefore to address the limitation of instrumentation, Stanford researchers developed a electrochemical lateral flow assay diagnostics platform that eliminates the need for expensive analyzers or reader instrumentation typically required for quantitative tests. Instead the eLFA communicates the presence or abundance of compounds of interest to a user wirelessly via a cell phone app. This advanced eLFA technology platform presents commercial opportunities as it is compatible with the two most widely utilized molecular diagnostics test formats, sandwich assays and competition assays. Stage of development Prototype Applications include Tests that can identify and wirelessly communicate the presence or abundance of:  Infectious disease antigens or antibodies in biological samples Human and veterinary health and wellness biomarkers in biological samples and/or chemical irritants or toxins in environmental samples Adulterants or impurities in foods, chemicals and pharmaceuticals  , Infectious disease antigens or antibodies in biological samples, Human and veterinary health and wellness biomarkers in biological samples and/or chemical irritants or toxins in environmental samples, Adulterants or impurities in foods, chemicals and pharmaceuticals. Advantages of the device are Accurate and low-cost, Eliminates the need of traditional test reader instrumentation., Capability to measure multiple biomarkers simultaneously, Powered wirelessly."
Additive manufacturing of iron components for magnetic shielding,https://techfinder.stanford.edu/technology/additive-manufacturing-iron-components-magnetic-shielding,"Researchers in the Gu Research Group and SUPER lab have developed an additive manufacturing method for making iron-based magnetic shielding coatings and components by controlling the geometry of the iron, leading to significantly better performance.  Magnetic shielding protects vulnerable devices used in automotives, aerospace and aviation, telecommunications, data storage, medical imaging equipment, high precision instruments, and more.  Permeability, magnetic saturation, thermal stability, and operating frequency range determine magnetic shield effectiveness. Iron has excellent magnetic saturation and thermal stability, but can only be used in the frequency range of 100 Hz due to eddy current losses. Fe-Si and other soft metal alloys are typically used, which are expensive and difficult to process. The Stanford researchers' additive manufacturing (AM) method leverages space-filling curves to increase the iron components frequency range three orders of magnitude to above 1 kHz, without affecting iron's saturation, permeability, or thermal stability.  The process is easier, faster, and less expensive than industry standards, and resulting prototypes meet or outperform industry standard devices made from more resistive nanocrystalline and amorphous compositions, and laminate devices made from electrical steel. (See graph)  In addition, the AM shield shape can conform closely to the shape of the component it is shielding, and other high-saturation and high temperature shielding materials may be used, such as FeNi and FeCo alloys. Stage of Development – Proof of Concept Topology optimization is ongoing for iron, other magnetic metallic alloys (FeNi and FeCo), and amorphous metals to increase their cut-off frequency to the MHz regime to compete with ferrites and Iron/Polymer composites.   Additively manufactured, space-filling curve prototype Hilbert structures with an inset of the CAD model including a comparison of the order 4 and order 5 cross-sections. (Image Courtesy the Gu Group and SUPER Lab)  Benchmark comparison of topology optimized additively manufactured components (o4, o5) vs. solid and laminated components (Image Courtesy the Gu Group and SUPER Lab) Applications include Custom magnetic shielding for: , Medical Devices and Medical Imaging Equipment, Electronics and Magnetic Storage Media, High-Precision Instruments (e.g. electron microscopes, etc), Automotive, Aerospace and Aviation, Telecommunications. Advantages of the device are Faster, easier processing at lower cost  - No need for complex stacking laminations. After printing, components can be cut off the substrate with no further processing before the device assembly., Custom design fabrication (via additive manufacturing) tailored to a particular application, Superior performance."
Baseband Quantum Networks for Superconducting Circuits,https://techfinder.stanford.edu/technology/baseband-quantum-networks-superconducting-circuits,"Stanford researchers have developed an approach to enable larger superconducting quantum systems that can likely span several refrigerators, necessitating connecting qubits across refrigerators efficiently. Current connectors are limited in its scalability. Superconducting coaxial cables have not been seriously considered for connecting qubits in neighboring dilution refrigerators because they lose quantum information too quickly at typical superconducting qubit frequencies (approximately 2-8 GHz). However, it is known that such cables are extremely low loss at low frequencies when the wavelength of light is comparable to the fridge-to-fridge separation. This invention enables qubits to be strongly coupled to the low-frequency modes of superconducting coaxial cables using a circuit that transduces quantum information from typical qubit frequencies down to a lower frequency, the so-called baseband, where the tradeoff between frequency-dependent loss and thermal fluctuations is optimized. Stage of Development Applications include Quantum computing data centers,  where computational tasks can be distributed over superconducting quantum processors in different dilution refrigerators, End user will be researchers and industry  seeking to run larger quantum simulations or solve larger optimization problems not currently possible with current computation capabilities. Advantages of the device are Scalable, Improves the accuracy and capacity of the quantum channel,   especially using frequencies around 200 MHz instead of 8 GHz, Enables many hundreds of times increase in transmission rates,  especially in contrast to other approaches, i.e. using optical photons, or microwave photons through waveguides."
