title,link,description
B7H3-Targeting Peptides,https://techfinder.stanford.edu/technology/b7h3-targeting-peptides,"Theranostics represents a paradigm shift in cancer treatment, offering a more personalized and molecular approach to cancer diagnosis and treatment with striking efficacy and low toxicity. The significance of theranostics therefore lies in its ability to personalize and optimize medical treatments by tailoring them to individual patients. B7H3 is a transmembrane protein, that has recently been identified as a pan-cancer antigen with dense expression across a multitude of cancer types and with restricted expression in normal tissue, rendering B7H3-targeted radiotheranostics a viable treatment option for millions of patients. Despite the promise of B7H3, no peptide ligands have been identified. Furthermore, because the protein lacks structural and functional characterization there is currently no a priori way to design ligands. Stanford researchers have discovered B7H3-targeting peptides from peptide phage display that can be used for cancer theranostic applications, such as for diagnostic imaging and peptide-targeted radionuclide therapy. This would allow for both the diagnosis and treatment of various advanced or refractory cancers lacking other viable therapies. The newly identified peptide is the first peptide identified specific to B7H3, and when chelated to 68Ga and 177Lu, the first radionuclide therapy for B7H3. Researchers predict that the B7H3 peptide-targeted radiotherapeutics would have preferential uptake in tumor tissue where the majority of DNA damage would occur, with timely elimination from clearance organs. Stage of Development In vitro and in vivo: proof of concept in cell lines Applications include Cancer diagnostic, Radionuclide cancer therapy, Cancer theranostics. Advantages of the device are Cost effective synthesis, Can be used to diagnose and treat a range of resistant and refractory cancer types, Favorable pharmacokinetics, First peptides identified specific to B7H3  Can chelate 68Ga and 177Lu for radionuclide therapy  , Can chelate 68Ga and 177Lu for radionuclide therapy."
Efficient wide-field nanosecond imaging methods using Pockels cells for low-light applications,https://techfinder.stanford.edu/technology/efficient-wide-field-nanosecond-imaging-methods-using-pockels-cells-low-light,"Stanford researchers at the Kasevich Lab have developed a module that can attach to any standard optical system or sensor for wide-field, time-resolved imaging. This invention enables nanosecond image gating and modulation in low-light conditions, opening new applications for wide-field imaging such as fluorescence lifetime imaging microscopy (FLIM). This technology enables the first wide-field lifetime camera that is compatible with single-molecule microscopy. Existing sensors for wide-field nanosecond imaging (e.g. time-of-flight cameras, SPAD arrays, and gated intensifiers) sacrifice performance and are not compatible with low-light applications in bioimaging and fluorescence microscopy. The researchers have demonstrated the use of electro-optic wide-field imaging gates for nanosecond temporal resolution with high photon collection efficiency. Their method enables wide-field FLIM in a single exposure image on any standard camera sensor. By acquiring all pixels in parallel they demonstrate 5 orders of magnitude improvement in imaging speeds compared to single photon counting. They have also demonstrated 39 MHz image modulation for fluorescence lifetime microscopy of single molecules at high frame rate. This allows FLIM applications in super-resolution microscopy and observations of single-molecule dynamics such as FRET. Prototypes have been tested on commercial microscopes. On-going work: Researchers are continuing to improve the technique to allow larger imaging field-of-view, higher frequency operation, and improved electro-optic configurations. A compact and user-friendly module for MHz resonant image modulation is under development. The inventors have expanded upon this technology in  Stanford Docket 19-424: Wide-field Resonant Electro-optic Imaging Devices and Applications . Stage of Development: Figures:  Figure description-  A) Schematic of Pockels cell detection with two temporal bins. Input from an imaging system (pulsed excitation and fluorescence from a microscope is drawn) is split by two polarizing beam-splitters before and after Pockels cell. All emitted photons are captured in four spatially separated images on any standard detector. Image intensities on the sensor encode temporal information from the Pockels cell modulation. Any modulation V(t) may be applied.  Figure description- Wide-field FLIM Examples: (a) FLIM image of a mouse kidney slice differentiating two fluorophores by lifetime (b) Single-molecule FLIM image on a mixture of molecules having different lifetimes – dynamics for each molecule may be observed at high frame-rate (see Publications) - 10 µm scalebar  (c) Combination of FLIM and single-molecule super-resolution microscopy. Lifetime is measured for each single molecule burst and plotted at the localization coordinate (1 µm scalebar, 100 nm inset) Movie 1: Propagating action potentials. Electrical activity of a single neuron in a living fruit fly (Drosophila) using fluorescence lifetime.  Movie 2: Propagating action potentials. Electrical activity of a single neuron in a living fruit fly (Drosophila) using fluorescence lifetime.  Movie 3: Propagating action potentials. Electrical activity of a single neuron in a living fruit fly (Drosophila) using fluorescence lifetime.  Applications include Fluorescent lifetime imaging microscopy (FLIM), Single-molecule FLIM and FRET imaging, Wide field lock-in detection and modulated imaging, Imaging FRET probes such as voltage indicators, Combination of FLIM with super-resolution and single-molecule microscopy, Combination of FLIM with light-sheet microscopy, Endoscopic imaging and clinical diagnostics, LIDAR and 3D scanning, Multi-dimensional / 'hyperspectral' imaging combining lifetime with other imaging dimensions, Single-shot, multi-frame nanosecond imaging, Time-to-space conversion and temporal image multiplexing with gated cavity optics, Time-resolved charged particle detectors. Advantages of the device are High photon efficiency, All-optical method, FLIM acquisition on standard scientific cameras, FLIM acquisition in a single-frame exposure, Demonstrated 5 order of magnitude throughput improvement, Single-molecule compatible, No photon loss due to gating, Compatible with existing imaging systems and low-cost CMOS/CCD sensors."
Wide-field Resonant Electro-optic Imaging Devices and Applications,https://techfinder.stanford.edu/technology/wide-field-resonant-electro-optic-imaging-devices-and-applications,"The Kasevich lab has expanded on an earlier invention ( Stanford Docket 18-388: "" Efficient wide-field nanosecond imaging methods using Pockels cells for low-light applications""  ) that achieves efficient ultrafast temporal imaging on standard camera sensors. Current fast camera sensors have significant drawbacks and achieve nanosecond resolution only by sacrificing performance and sensitivity. Low-cost nanosecond camera sensors with favorable performance and form-factor are more desirable, especially for applications in LIDAR and fluorescence lifetime imaging. The Kasevich lab has developed resonant electro-optic imaging techniques and optimized the design of electro-optic crystals to allow compact, low-cost, and wide angular field-of-view imaging. Embodiments include multi-layer structures of low-cost electro-optic crystals and polarization optics, configurations to reduce switching voltage, and integrated systems for wide-field imaging. This technology is an advantageous approach to Pockels cell LIDAR beyond conventional ""flash"" imaging mode – combining high distance resolution with large depth of fields, which is not possible with traditional Pockels cell approaches. It is also compatible with mode-locked laser sources and megahertz repetition rates, and facilitates compact and low-cost nanosecond imaging and LIDAR on standard CMOS sensors. Stage of Development - Prototype Applications include LIDAR with enhanced resolution at large depth of field, Wide field ultrafast imaging, LIDAR and time-of-flight imaging for remote sensing, mapping, autonomous cars, 3D cameras, 3D scanners, and foreground object detection, Fluorescence lifetime imaging microscopy (FLIM) , FLIM + wide-field microscopy techniques, Single-molecule imaging and super-resolution microscopy, Light sheet microscopy, Medical diagnostics and endoscopic imaging, High speed optical switching. Advantages of the device are Compatible with standard CMOS cameras, Reduced switching voltage and power requirements, High photon efficiency, Compact and inexpensive construction, Industrially scalable, Avoids dead-time and throughput limitations of single-photon counting detectors."
Engineering functional cardiac tissue using a twist-expand mechanical bioreactor,https://techfinder.stanford.edu/technology/engineering-functional-cardiac-tissue-using-twist-expand-mechanical-bioreactor,"Stanford researchers have invented a twist-expand mechanical bioreactor that provides an appropriate in vitro microenvironment for induced pluripotent stem cell (iPSC) derived cardiomyocytes to achieve biomimetic anisotropic alignment and form contractile cardiac tissue. Many studies have successfully demonstrated directed differentiation of iPSCs into cardiomyocytes. However, further assembling and maturing the iPSC-derived cardiomyocytes to mimic the mechanics of the native heart tissue remains a challenge. To overcome this challenge, studies have created microenvironments resembling that of primary cardiomyocytes during development: micropillar structures were placed to provide a 3D environment and exogenous cues were applied to facilitate anisotropic alignment of cells for coordinated contraction and electrical conduction. The engineered tissue's maturation was improved but still not comparable to the native heart. Researchers at Stanford have devised a platform that provides a more biomimetic microenvironment (Figure 1). Using advanced 3D bioprinting technology, cells were printed with soft silicone in preferred arrangements. The print was placed in an electrically conductive bioreactor that can be actuated to apply torsional force or pneumatic pressure to the silicone to introduce twisting and contractile cardiac mechanics that the micropillar approach neglected to include. This system has the potential to form functional macro-level heart tissues from iPSC-derived cardiomyocytes.  Stage of Development Prototype Applications include Cardiac tissue engineering, Drug testing, Disease modeling, Developmental studies. Advantages of the device are Mimics the complex contractile pattern of the native heart tissue better than other existing systems, Potential for personalized treatment."
Modeling human sensory ascending pathway in assembloids derived from human pluripotent stem cells,https://techfinder.stanford.edu/technology/modeling-human-sensory-ascending-pathway-assembloids-derived-human-pluripotent-stem,"The ascending somatosensory pathway transmits sensory information, including pain, touch and itch, from the peripheral nervous system to the brain. Dysfunctions in this pathway are linked to disorders like peripheral neuropathy and autism spectrum disorder. Despite a significant need for effective therapeutics modulating pain and other somatosensory modalities, clinical translation remains challenging, which is likely related to species-specific features and the lack of in vitro models to directly probe and manipulate this polysynaptic pathway. To remedy this issue, Stanford researchers have developed the first human ascending sensory pathway model using assembloids. The method involves differentiating human induced pluripotent stem (hiPS) cells into regionalized neural organoids resembling the components of the human sensory ascending pathway (Figure 1). This model provides a unique opportunity to directly study and manipulate the human sensory ascending pathway, overcoming previous challenges. This platform also enables functional analysis, including synchronized neural activity across the entire sensory pathway, offering a powerful tool for drug discovery targeting sensory disorders. Figure:  Figure description: Building human ascending somatosensory assembloid from human induced pluripotent stem cells. Image Credit: inventors Stage of Development Proof of concept- models have shown to trigger and ascend the full sensory pathway Applications include Autism spectrum disorder, Peripheral neuropathy, Research mechanisms of sensory processing and pathogenesis, Identification of novel therapeutic targets. Advantages of the device are First human cellular model of the ascending sensory pathway, Human-Specific Sensory Circuitry: Provides the first in vitro model that resembles the human ascending somatosensory pathway, overcoming the limitations of species differences in animal models., Comprehensive Functional Analysis: Enables simultaneous monitoring of neural activity across multiple interconnected regions (sensory, spinal, thalamic, and cortical) through calcium imaging and extracellular recordings., Targeted Disease Modeling and Therapeutic Screening: Allows for the study of sensory disorders, such as pain insensitivity, through genetic manipulation (e.g., SCN9A knockout) and offers a platform for high-throughput drug discovery targeting human sensory pathways.."
Composition and Method for Autonomous RNA Switches for Translational Control,https://techfinder.stanford.edu/technology/composition-and-method-autonomous-rna-switches-translational-control,"Stanford scientists have discovered that the untranslated region (UTR) of RNA can be engineered into autonomous switches capable of both sensing native biological conditions (e.g. T cell activation) and promptly responding by initiating the translation of a therapeutic sequence (e.g. a chimeric antigen receptor). Autonomous mRNA switches can provide dynamic regulation within cellular immunotherapies and offer broad utility in next-generation mRNA therapeutics, such as engineering chimeric antigen receptor (CAR) T cells in vivo. Ex vivo CAR T cell therapy has shown significant success in treating oncology patients and combating malignant tumors. However, this approach is limited by the expensive and time-consuming ex vivo production process, which can take several weeks, and the challenge of administering only a single effective dose to patients, leading to potential tumor relapse. In contrast, in vivo CAR T cell therapy offers a promising solution by directly engineering T cells within patients using mRNA therapeutics. This innovative approach enables rapid and customizable production, with the transient nature of mRNA therapies allowing for precise temporal control of therapeutic doses. Nevertheless, advancements are needed to develop technologies capable of sensing relevant biological conditions and tightly regulating the translation of therapeutic payloads. Novel strategies for controlling mRNA expression in T cells will enable the development of in vivo T cell therapies that can alleviate T cell dysfunction while preserving the protective immune responses required for human health. Novel engineered UTR sequences resulted in RNA elements that can sense T cell signals and modulate therapeutic mRNA expression as ON/OFF switches. These mRNA switches have been shown to induce the translation of genetic payloads upon T-cell activation. The use of these mRNA switches to control the translation of a CAR in engineered T cells resulted in the expression of the CAR and the killing of antigen-positive tumor cells. Importantly, when co-cultured with antigen-negative cells, there was no difference in CAR expression or killing when compared to baseline. Consequently, autonomous mRNA switches have the potential to enhance cellular immunotherapies and enable the development of in vivo CAR T cell therapies. Stage of Development: Preclinical – in vitro data Continued research – in vivo demonstration of efficacy and further description of switches that capture other immune cell states (e.g. T cell exhaustion, NK cell activation, etc.). The inventors have demonstrated that the switch works efficiently with viral delivery methods, and future work will demonstrate its utility with non-viral delivery methods in various molecular forms. Applications include Production of mRNA switches that can sense and respond to native biological conditions (e.g. T cell activation), Synthetic regulation of therapeutic payloads in situ, Engineering of cellular immunotherapies in vivo. Advantages of the device are Precise control of the translation of genetic payloads, Rapid and customizable production of mRNA switches, Flexible temporal control of therapeutic dosing due to the transient nature of mRNA."
One-Time Delivery of Genetically Engineered Stem Cells Enable Long-Term Secretion of Therapeutic Antibodies for Treatment of HIV-1,https://techfinder.stanford.edu/technology/one-time-delivery-genetically-engineered-stem-cells-enable-long-term-secretion,"Stanford researchers have engineered hematopoietic stem cells to provide long-term secretion of chosen therapeutic antibodies, eliminating the need of repeated dosing for delivery. Thirty nine million people worldwide are living with HIV infection. Autologous transplantation of specific hematopoietic stem and progenitor cells (HSPCs) is the only known cure for HIV-1 infection. However, this treatment is extremely limited due to the rarity of specific matched donors, the morbidities associated with allogeneic transplantation, and the prevalence of HIV-1 strains resistant to select gene knockout treatments alone. To circumvent these limitations, Stanford researchers genetically engineered HSPCs that secrete antibodies against various targets, including but not limited to HIV, PCSK9, and TNF-alpha. The genetically engineered HSPCs can be delivered via a one-time therapy through autologous transplantation. This technology could be used to develop autologous hematopoietic stem cell transplantation therapies for the long-term delivery of therapeutic antibodies for various diseases. The engineered cells also have the potential to improve current commercial treatment strategies that address long-term control of HIV-1 infection; A disease that currently requires lifetime administration of antiretroviral therapy. Stage of research Proof of concept Applications include Secrete antibodies against various targets (i.e. HIV, PCSK9, and TNF-alpha), Autologous hematopoietic stem cell transplantation therapies, Research tool for control of HIV-1, Development of antibody treatment therapies. Advantages of the device are Long-term secretion/sustained delivery of chosen therapeutic antibodies without repeated dosing, Can express multiple antibodies simultaneously, Limited comparable cell-based products currently on the market."
G-I-ntelligent pill (GIntellipill) for active sample collection in the gastrointestinal tract,https://techfinder.stanford.edu/technology/g-i-ntelligent-pill-gintellipill-active-sample-collection-gastrointestinal-tract,"Researchers at Stanford University have developed an ingestible smart pill to sample biomarkers from the gastrointestinal (GI) tract. The GI tract plays an important role in maintaining overall health, as it is responsible for digesting food, absorbing nutrients, and eliminating waste. Sampling from the GI tract, particularly its mucous layer, is essential in understanding gut health and disease. Bioanalytes from the mucus can provide insights into inflammation, metabolic function, and immune response. Currently, invasive procedures like endoscopy and colonoscopy are used to sample from the GI tract. There is a need for a non-invasive method. Smart pills have recently emerged as non-invasive sampling platforms. However, to date, they have relied on passive diffusion and thus are not suitable for viscous mucus. Stanford researchers have designed a smart pill that can be swallowed and docked at a desired location in the GI tract for active sampling of the mucus. After confirming the pill's location within the GI tract, its hydrodynamic screw is remotely actuated. The rotational motion facilitates the collection of mucus samples along its spiral path, directing them towards a dedicated collection chamber. This technology could enable easy, simple, affordable, and repeat sampling of GI tract regions of interest.  Stage of Development Prototype Applications include Precision medicine, Early disease detection, Health monitoring, Disease management. Advantages of the device are Can collect high viscosity samples, Multiple sampling locations, Cost-effective, Non-invasive, Enables frequent high quality data collection."
Spinner Device for Kidney Stone and Dust Removal,https://techfinder.stanford.edu/technology/spinner-device-kidney-stone-and-dust-removal,"Researchers at Stanford University have developed a novel kidney stone extraction device that can be used during ureteroscopy to simultaneously remove kidney stone fragments and dust without affecting renal pressure. Kidney stones are clusters of minerals and salts that form in the urinary tract, potentially causing severe pain from urinary tract obstruction, renal injury, or infections. During ureteroscopy, an endoscope is inserted through the urethra to break up larger stones with lasers or ultrasound. Fragments are either retrieved or, if small, allowed to pass naturally. Unfortunately, residual fragments and dust often cause recurrent symptomatic obstruction and stone regrowth. Therefore, there is a critical need for a more efficient clearance method. In response, vacuum-assisted sheaths have been recently introduced. However, they remove renal fluid along with the debris, necessitating fluid infusion to sustain the renal pressure. Stanford researchers at the Zhao Lab have designed a safer and more efficient kidney stone fragments and dusts extraction device that can be used together with kidney stone breaking devices. Their device is based on rotation to manipulate the flow and create a vortex that provides a localized suction towards the device to capture the stone fragments and dusts in the device. Unlike the vacuum-assisted device, this device avoids the risk of collapsing the kidney due to irregularly reduced intrarenal pressure. Stage of Development Proof of concept – in vitro data Applications include Kidney stone removal. Advantages of the device are Complete clearance of stones of varying sizes, Reduced treatment time, Reduced risk of recurrence."
Stereotactic Deep Brain Transcranial Magnetic Stimulation,https://techfinder.stanford.edu/technology/stereotactic-deep-brain-transcranial-magnetic-stimulation,"Stanford researchers have patented systems and methods for Stereotactic Deep Brain Transcranial Magnetic Stimulation (TMS). Deep Brain TMS can be used to stimulate, enhance or inhibit neural activity in deep-brain target regions for diagnostic and predictive (e.g., treatment formulation) purposes. This technology can be used for neuroscience research as well as clinical psychiatric, neurological, and neurosurgical applications. Applications include Neuroscience research, Clinical psychiatric, neurological, and neurosurgical applications including but not limited to: , Alzheimer's disease, Brain stimulation, Neurological, Obsessive-compulsive disorder, Pain management, Parkinson's disease, Psychiatric, Seizures. Advantages of the device are Deep, targeted application, Non-invasive."
Using a probabilistic model to infer target labels for unsupervised BCI recalibration,https://techfinder.stanford.edu/technology/using-probabilistic-model-infer-target-labels-unsupervised-bci-recalibration,"Stanford researchers have developed a system that addresses a critical challenge in brain-computer interface (BCI) technology: the need for tedious and lengthy recalibration procedures that disrupt daily use. It features a BCI cursor decoder that automatically adapts to the user's brain activity, eliminating the need for frequent manual recalibration. The system records brain signals, translates them into commands to control a cursor, and enables users to perform tasks like checking email, browsing the Internet, and interacting with graphical user interfaces. Over time, it improves its accuracy by learning from the brain signals without requiring human intervention, making it more reliable and user-friendly for daily computer navigation. Applications include BCI cursor decoders using surface recording signals (EEG, MEG, fNIRS), BCI cursor decoders using intracranial approaches (ECoG, intracortical), Unsupervised retraining of cursor decoders for use in patient population. Advantages of the device are Automates BCI cursor decoder recalibration, eliminating tedious manual calibrations, Improves upon BCI cursor decoder calibration stability over time, Automatically adapts BCI cursor decoder to the user's brain activity."
